{"diagnosis":"Le service conserve deux copies du taux: `source_rate` et `cached_rate`. `update_configuration()` met seulement `source_rate` à jour, tandis que `quote()` continue de calculer avec `cached_rate`. Après une mise à jour de configuration, les devis utilisent donc l'ancien taux et `trace_is_fresh()` devient faux.","root_cause_file":"src/lib.rs","root_cause_line":11,"minimal_patch":"diff --git a/src/lib.rs b/src/lib.rs\n--- a/src/lib.rs\n+++ b/src/lib.rs\n@@ -10,6 +10,7 @@ impl PricingEngine {\n \n     pub fn update_configuration(&mut self, rate: f64) {\n         self.source_rate = rate;\n+        self.cached_rate = rate;\n     }\n \n     pub fn quote(&self, base: f64) -> f64 {","evidence":["`src/lib.rs:11-13`: `update_configuration()` assigne seulement `self.source_rate = rate;` et laisse `cached_rate` inchangé.","`src/lib.rs:15-17`: `quote()` calcule `base * self.cached_rate`, donc le devis dépend du cache obsolète après une mise à jour.","`src/lib.rs:19-21`: `trace_is_fresh()` compare `source_rate` et `cached_rate`; le binaire de trace confirme l'écart avec `source_rate=1.5 cached_rate=1.0`.","`cargo test --test reproduction` échoue à `tests/reproduction.rs:7`: après `new(0.8)` puis `update_configuration(1.2)`, le résultat est `200.0` au lieu de `300.0`, soit `250.0 * 0.8` au lieu de `250.0 * 1.2`.","`cargo test --test test_18` échoue à `tests/test_18.rs:7`: après `new(1.0)` puis `update_configuration(1.5)`, le résultat est `100.0` au lieu de `150.0`, soit l'ancien taux initial."],"rejected_hypotheses":[{"name":"Erreur d'arrondi en virgule flottante","reason":"Les écarts observés sont de 100.0 et 50.0, et correspondent exactement à l'utilisation de l'ancien taux, pas à une imprécision flottante."},{"name":"Mauvaise initialisation dans `PricingEngine::new()`","reason":"`src/lib.rs:7-8` initialise bien `source_rate` et `cached_rate` à la même valeur; le défaut apparaît seulement après `update_configuration()`."},{"name":"Test de reproduction incorrect ou isolé","reason":"Deux tests indépendants expriment le même contrat: une mise à jour de configuration doit changer le devis. Ils échouent tous les deux selon le même motif."},{"name":"Le binaire de trace serait seul défectueux","reason":"Le binaire ne fait qu'appeler l'API publique et vérifier `trace_is_fresh()`; les tests d'intégration échouent aussi directement sur `quote()`, sans dépendre du binaire."}],"verification_commands":["cargo test --test reproduction","cargo test --test test_18","cargo run --bin trace_212"],"risk_assessment":"Le patch minimal est très local: synchroniser `cached_rate` lors de `update_configuration()`. Le risque principal est si `cached_rate` était censé être rafraîchi paresseusement ailleurs, mais aucun code existant ne fournit ce mécanisme, et les tests ainsi que le trace attendent explicitement une propagation immédiate."}